Ссылка;Высказывание;Ключевые слова;Счёт;;;;
https://vk.com/covid19#utm_source=vk&utm_medium=cpc&utm_campaign=web_left_nav;На данный момент специальных лекарств для профилактики или лечения нового коронавируса нет - учёные работают над их созданием.;лекарство;1;;;;
https://www.spb.kp.ru/daily/27113/4192700/;Препаратов с доказанной эффективностью против COVID-19 нет.;лекарство;2;;;;
https://takiedela.ru/news/2020/05/14/otvety-na-kovid-voprosy/;Лечения COVID-19 не существует, но препараты против коронавируса активно разрабатывают.;лекарство;3;;;;
https://takiedela.ru/news/2020/05/14/otvety-na-kovid-voprosy/;На сегодняшний день специфического лечения COVID-19 не существует.;лекарство;4;;;;
https://xn--80aesfpebagmfblc0a.xn--p1ai/about-covid/#myths;Лекарств, зарегистрированных для лечения или профилактики именно COVID-19, в настоящее время в мире не существует.;лекарство;5;;;;
https://www.bbc.com/russian/features-52065978;Специфической терапии от SARS-CoV-2 пока нет. ;лекарство;6;;;;
https://meduza.io/feature/2020/06/05/v-rossii-lekarstva-ot-koronavirusa-regulyarno-ispytyvayut-narushaya-eticheskie-normy-i-vozmozhno-zakon-vot-chetyre-glavnye-problemy;Сейчас в России не проблема получить разрешение на исследование препаратов от COVID-19;лекарство;7;;;;
https://ru.wikipedia.org/wiki/COVID-19;Против вируса SARS-CoV-2 отсутствует какая-либо специфичная противовирусная терапия[14] и нет доказательств эффективной иммуномодулирующей терапии[94].;лекарство;8;;;;
https://hromadske.ua/ru/posts/dejstvitelno-li-remdesivir-pobedit-covid-19;А препаратов, которые действительно будут хорошо бороться с SARS-CoV-2, стоит ожидать через несколько лет.;лекарство;9;;;;
https://www.bbc.com/russian/features-52731760;Поскольку штамм коронавируса SARS-Cov-2, вызывающий Covid-19, появился недавно, он нов и малоизучен, то пока не существует некоего единого одобренного препарата, который помогал бы организму больного справляться с вызванными им осложнениями.;лекарство;10;;;;
http://www.truthinfo.info/prostaya-fraza-falun-dafa-nesyot-dobro-vylechivaet-ot-koronavirusa/?fbclid=IwAR1E5p25y4eLpEUWUpTAVR9cP1eOL279XlOjIOrnJFlUNFaZq8khwwvG44s;Простая фраза «Фалунь Дафа несёт добро» вылечивает от коронавируса;лекарство;11;;;;
https://ntinews.ru/in_progress/likbez/chem-lechitsya-ot-koronavirusa-obzor-rossiyskikh-i-zarubezhnykh-preparatov.html;Однако в некоторых странах, например, в Китае, средства народной медицины включены в рекомендации по лечению COVID-19.;лекарство;12;;;;
https://ntinews.ru/in_progress/likbez/chem-lechitsya-ot-koronavirusa-obzor-rossiyskikh-i-zarubezhnykh-preparatov.html;Еще раз: на сегодняшний день препарата, который лечит от коронавируса нет.;лекарство;13;;;;
https://yandex.ru/q/question/health/dobryi_den_nado_li_dlia_profilaktiki_6822d0e1/?answer_id=4a7b0def-e272-4414-b484-9ab359c8afa7#4a7b0def-e272-4414-b484-9ab359c8afa7;Но вы должны понимать, что препарата против нового вида вируса нет!;лекарство;14;;;;
https://www.youtube.com/watch?v=Sd9Fqva1QQY&lc=UgxTfIZ-Y6Jl6vtL9fF4AaABAg.9908wUHJU26992JPbVGtRQ;Лекарств от ковида нет.;лекарство;15;;;;
https://lenta.ru/news/2020/08/07/vino/;Ученые из Университета Лаваля в Канаде обнаружили в вине антиоксидант, способный понизить тяжесть острого респираторного дистресс-синдрома (ОРДС), который часто сопровождает заболевание, вызванное коронавирусом нового типа. ;лекарство, ОРДС;1;;;;
https://www.gazeta.ru/social/2020/05/27/13097641.shtml;Вскоре в России появится препарат для профилактики тяжелейшего осложнения COVID-19 — цитокинового шторма, анонсировал глава Минздрава РФ Михаил Мурашко.;лекарство, цитокиновый шторм;1;;;;
https://www.gazeta.ru/social/2020/05/27/13097641.shtml;В России зарегистрирован препарат для профилактики цитокинового шторма — тяжелейшего осложнения COVID-19, сообщил министр здравоохранения страны Михаил Мурашко в эфире Первого канала.;лекарство, цитокиновый шторм;2;;;;
https://riamo.ru/article/429785/uchenye-vyyasnili-otkuda-proizoshel-koronavirus.xl;Ученые из Китая обнаружили у летучих мышей, найденных в провинции Юннань, следы вируса RmYN02, который схож с новым коронавирусом;летучая мышь;1;;;;
https://rg.ru/2020/04/13/rospotrebnadzor-limony-med-i-chesnok-ne-pomogut-pri-koronaviruse.html;Роспотребнадзор: Лимоны, мед и чеснок не помогут при коронавирусе;лимон, мед, чеснок;1;;;;
https://rg.ru/2020/04/13/rospotrebnadzor-limony-med-i-chesnok-ne-pomogut-pri-koronaviruse.html;Лимоны, мед и чеснок укрепляют иммунитет, но существенной роли в профилактике коронавирусной инфекции не играют.;лимон, мед, чеснок;2;;;;
https://ria.ru/20200414/1569999135.html;"Препарат ""Лопинавир"", который изначально применялся при терапии ВИЧ-инфекции, но был рекомендован и для лечения коронавируса, при тяжёлых формах COVID-19 оказался неэффективен";лопинавир;1;;;;
https://ria.ru/20200414/1569999135.html;"К сожалению, уже получены данные из Китая, что при тяжёлых формах разницы в течении заболевания у тех, кто получал ""Лопинавир"", и тех, кто не получал, нет.";лопинавир;2;;;;
https://static-1.rosminzdrav.ru/system/attachments/attaches/000/050/116/original/28042020_%D0%9CR_COVID-19_v6.pdf;Проведенное рандомизированное контролируемое исследование продемонстрировало, что монотерапия лопинавиром+ритонавиром заболевания, вызванных SARS-CoV-2, не сокращала сроки госпитализации и не демонстрировала большую эффективность, чем стандартная симптоматическая терапия.;лопинавир, ритонавир;1;;;;
https://gmpnews.ru/2020/06/primenenie-lopinavira-ritonavira-pokazalo-otsutstvie-klinicheskoj-polzy-v-otnoshenii-covid-19/;29 июня руководящий комитет исследования пришел к выводу, что у пациентов, госпитализированных с COVID-19, не было положительного эффекта от применения  лопинавира-ритонавира.;лопинавир, ритонавир;2;;;;
https://gmpnews.ru/2020/06/primenenie-lopinavira-ritonavira-pokazalo-otsutstvie-klinicheskoj-polzy-v-otnoshenii-covid-19/;Применение лопинавира-ритонавира показало отсутствие клинической пользы в отношении COVID-19;лопинавир, ритонавир;3;;;;
https://gmpnews.ru/2020/06/primenenie-lopinavira-ritonavira-pokazalo-otsutstvie-klinicheskoj-polzy-v-otnoshenii-covid-19/;Эти данные убедительно исключают какую-либо значительную пользу, если рассматривать процент смертности, от применения лопинавира-ритонавира у госпитализированных пациентов с COVID-19.;лопинавир, ритонавир;4;;;;
https://www.rbc.ru/rbcfreenews/5efa88f19a794766e232bbb1;Комбинация препаратов лопинавир и ритонавир бесполезна для лечения коронавирусной инфекции COVID-19.;лопинавир, ритонавир;5;;;;
https://www.healtheconomics.ru/news/item/lopinavir-ritonavir-v-lechenii-koronavirusa-otritsatelnye-rezultaty;У госпитализированных взрослых с тяжелой инфекцией Covid-19 применение лопинавира/ритонавира не имеет преимуществ перед стандартной терапией.;лопинавир, ритонавир;6;;;;
https://vk.com/wall-193849773_29077?reply=29185&thread=29086;маски являются мерой профилактики и способны снизить риск заражением COVID-19;медицинаская маска;1;;;;
https://www.mythdetector.ge/ru/myth/7-mifov-o-covid-19;Отвечая на вопрос о роли масок во время пандемии, Фаучи сказал 23 июня, что, хотя маска не защищает нас на 100%, мы все же более защищены от вируса, когда носим ее, чем когда мы ее не надеваем.;медицинаская маска;2;;;;
https://www.mythdetector.ge/ru/myth/7-mifov-o-covid-19;По состоянию на сегодня, CDC также призывает население носить маски, поскольку, по заявлению ведомства, она снижает шансы распространения COVID-19.;медицинаская маска;3;;;;
https://www.youtube.com/watch?v=FT4NWXTzhas;Коронавирус: маски вас не спасут :);медицинаская маска;4;;;;
https://www.interfax.ru/world/712529;"Ранее ВОЗ рекомендовала носить маски, когда наблюдается ускоренное ""активное массовое распространение"" коронавирусной инфекции и нет возможности соблюдать дистанцию.";медицинаская маска;5;;;;
https://www.skyscanner.ru/news/sovety-pro-maski-na-bortu-i-perelety-pri-koronaviruse;Доказано, что коронавирус — прежде всего респираторная инфекция, поэтому если защищать рот и нос маской, можно снизить риск его передачи от человека к человеку.;медицинаская маска;6;;;;
https://www.skyscanner.ru/news/sovety-pro-maski-na-bortu-i-perelety-pri-koronaviruse;В целом ношение маски не гарантирует, что вы защищены от заражения коронавирусом или другой респираторной инфекцией.;медицинаская маска, путешествия;1;;;;
https://www.bbc.com/russian/features-52835770#:~:text=%D0%9C%D0%B0%D1%81%D0%BA%D0%B8%20%D0%B4%D0%B5%D0%B9%D1%81%D1%82%D0%B2%D0%B8%D1%82%D0%B5%D0%BB%D1%8C%D0%BD%D0%BE%20%D0%BF%D0%BE%D0%BC%D0%BE%D0%B3%D0%B0%D1%8E%D1%82%20%D0%BF%D1%80%D0%BE%D1%82%D0%B8%D0%B2%20%D0%BA%D0%BE%D1%80%D0%BE%D0%BD%D0%B0%D0%B2%D0%B8%D1%80%D1%83%D1%81%D0%B0,%D0%BF%D0%B5%D1%80%D0%B5%D0%BD%D0%BE%D1%81%D1%8F%D1%82%20%2D%20BBC%20News%20%D0%A0%D1%83%D1%81%D1%81%D0%BA%D0%B0%D1%8F%20%D1%81%D0%BB%D1%83%D0%B6%D0%B1%D0%B0;Материал, из которого сделаны хирургические маски, заметно понижает вероятность заражения Covid-19, а в случае инфицирования - тяжесть самого заболевания.;медицинская маска;1;;;;
https://www.business-gazeta.ru/article/461452;А почему столько ажиотажа вокруг медицинских масок, ведь, как утверждают врачи, они не спасают от коронавируса?;медицинская маска;2;;;;
https://vk.com/wall-193136226_26962?reply=27051&thread=27013;к сожалению эти маски от ковида никак не помогут.;медицинская маска;3;;;;
https://vk.com/wall-193136226_26753?reply=26766;Непонятная ситуация с масками ,бесполезность которых доказали учёные вирусологи.;медицинская маска;4;;;;
https://vk.com/wall-193136226_26753?reply=26801&thread=26766;бесполезны обычные маски, точнее они не защитят от заражения, но уменьшат распространяемую вирусную нагрузку для других если вы болеете. ;медицинская маска;5;;;;
https://www.bbc.com/russian/features-52835770#:~:text=%D0%9C%D0%B0%D1%81%D0%BA%D0%B8%20%D0%B4%D0%B5%D0%B9%D1%81%D1%82%D0%B2%D0%B8%D1%82%D0%B5%D0%BB%D1%8C%D0%BD%D0%BE%20%D0%BF%D0%BE%D0%BC%D0%BE%D0%B3%D0%B0%D1%8E%D1%82%20%D0%BF%D1%80%D0%BE%D1%82%D0%B8%D0%B2%20%D0%BA%D0%BE%D1%80%D0%BE%D0%BD%D0%B0%D0%B2%D0%B8%D1%80%D1%83%D1%81%D0%B0,%D0%BF%D0%B5%D1%80%D0%B5%D0%BD%D0%BE%D1%81%D1%8F%D1%82%20%2D%20BBC%20News%20%D0%A0%D1%83%D1%81%D1%81%D0%BA%D0%B0%D1%8F%20%D1%81%D0%BB%D1%83%D0%B6%D0%B1%D0%B0;Маски действительно помогают против коронавируса.;медицинская маска;6;;;;
https://xn--80aesfpebagmfblc0a.xn--p1ai/news/20200424-1559.html;Маски: барьер против коронавируса №1;медицинская маска;7;;;;
https://xn--80aesfpebagmfblc0a.xn--p1ai/news/20200424-1559.html;Носите маску, если вы кашляете или чихаете, или заботитесь о человеке с подозрением на инфекцию COVID-19.;медицинская маска;8;;;;
https://www.bbc.com/russian/features-52065978;хирургические маски НЕ защищают от коронавируса.;медицинская маска;9;;;;
https://www.mythdetector.ge/ru/myth/pocemu-zablokirovali-socialnye-seti-video-v-kotorom-utverzdaetsa-cto-koronavirus-ne-ubivaet;заявляют, что в ношении масок нет необходимости, поскольку лекарство от COVID-19 существует;медицинская маска;10;;;;
https://ru.wikipedia.org/wiki/COVID-19;Медицинские маски обычному населению рекомендуются в случае наличия респираторных симптомов[32] или в случае ухода за больным, у которого может быть COVID-19[91];медицинская маска;11;;;;
https://baigenews.kz/amp/news/bolezn_voznikaet_pri_dlitelnom_noshenii_maski/;"Медики считают, что защитные маски для лица, помогающие снизить риски передачи новой коронавирусной инфекции, несут также некоторые негативные последствия, пишет ""Ридус"".";медицинская маска;12;;;;
https://www.ridus.ru/news/334805;Маски для лица, хотя и помогают снизить риск передачи коронавируса, несут ряд негативных последствий, считают медики. ;медицинская маска;13;;;;
https://www.dw.com/ru/%D0%BF%D0%BE%D1%87%D0%B5%D0%BC%D1%83-%D0%BE%D0%B4%D0%BD%D0%BE%D1%80%D0%B0%D0%B7%D0%BE%D0%B2%D1%8B%D0%B5-%D0%BF%D0%B5%D1%80%D1%87%D0%B0%D1%82%D0%BA%D0%B8-%D0%BD%D0%B5-%D0%B7%D0%B0%D1%89%D0%B8%D1%89%D0%B0%D1%8E%D1%82-%D0%BE%D1%82-%D0%BA%D0%BE%D1%80%D0%BE%D0%BD%D0%B0%D0%B2%D0%B8%D1%80%D1%83%D1%81%D0%B0/a-53089499;Но если в эффективности защитных масок при профилактике COVID-19 сомнений, практически, не осталось (необходимость их использования признала и ВОЗ);медицинская маска;14;;;;
https://www.youtube.com/watch?v=33rsLhemnfg&lc=Ugyp3Dq3cHCxzIKRK614AaABAg.9C42vYIAez-9C8VA3u4Mqf;Намордники у собак, а это - маски для предотвращение распространения коронавируса. Эгоисты обычно их не носят.;медицинская маска;15;;;;
https://www.5.ua/ru/obshchestvo/kak-effektyvno-dezynfytsyrovat-zashchytnie-masky-yz-raznikh-tkanei-222555.html;Тканевая маска препятствует свободному распространению инфекционных вирусных частиц, снижая риск инфицирования COVID-19.;медицинская маска;16;;;;
https://26dsp.ru/node/237;В период активной циркуляции возбудителей гриппа, коронавирусной инфекции, и других возбудителей острых респираторных вирусных инфекций напоминаем о целесообразности использования одноразовой медицинской маски в качестве эффективной меры профилактики заражения и ограничения распространения инфекции.;медицинская маска;17;;;;
http://www.privatmed.ru/article/37/239/2538/;В рекомендациях ВОЗ от марта этого года по ношению медицинских масок в контексте нового коронавируса четко сказано,  что они не требуются для тех, кто здоров.;медицинская маска;18;;;;
https://ru.wikipedia.org/wiki/COVID-19;По состоянию на 5 июня отсутствовали какие-либо прямые доказательства пользы масок среди здорового населения в случае острых респираторных инфекций, включая COVID-19, однако есть свидетельства пользы масок для здоровых людей в домашних условиях и в условиях массовых мероприятий, что косвенно указывает на возможную пользу при широком применении[93].;медицинская маска;19;;;;
https://ru.wikipedia.org/wiki/COVID-19;При наличии симптомов, схожих с COVID-19, ВОЗ рекомендует больным ношение масок с соблюдением инструкций по их правильному использованию и утилизации, самоизоляцию, консультирование у медицинских работников при плохом самочувствии, мытьё рук и соблюдение дистанции по отношению к другим людям[92].;медицинская маска, самоизоляция, социальная дистанция;1;;;;
https://xn--80aesfpebagmfblc0a.xn--p1ai/faq/;Медицинская помощь всем пациентам с подозрением на новую коронавирусную инфекцию оказывается на бесплатной основе.;медпомощь;1;;;;
https://www.forbes.ru/tehnologii/399231-chem-lechat-ot-covid-19-v-rossii-i-mire-gid-po-preparatam;В апреле ФМБА сообщило, что в исследованиях, проведенных совместно с Научным центром микробиологии Минобороны, было доказано, что в культуре клеток мефлохин полностью блокирует негативное воздействие коронавируса SARS-CoV-2 (возбудителя COVID-19) в концентрации 2 мкг/мл.;мефлохин;1;;;;
https://www.kommersant.ru/doc/4342405;Британские ученые выяснили, что мужчины чаще умирают от коронавируса.;мужчины;1;;;;
https://iz.ru/975282/mariia-nediuk/gendernaia-bol-koronavirus-opasnee-dlia-muzhchin;Гендерная боль: коронавирус опаснее для мужчин;мужчины;2;;;;
https://iz.ru/975282/mariia-nediuk/gendernaia-bol-koronavirus-opasnee-dlia-muzhchin;Выяснилось, что две трети подтвержденных смертей от коронавируса — мужчины. ;мужчины;3;;;;
https://riafan.ru/1306827-vrach-obyasnila-pochemu-muzhchiny-umirayut-ot-koronavirusa-chashe-zhenshin;Мужчины в полтора раза чаще женщин умирают при тяжелом течении коронавирусной инфекции.;мужчины, женщины;1;;;;
https://www.dw.com/ru/%D0%BA%D0%BE%D1%80%D0%BE%D0%BD%D0%B0%D0%B2%D0%B8%D1%80%D1%83%D1%81-%D0%B4%D0%BB%D1%8F-%D0%BA%D0%BE%D0%B3%D0%BE-%D0%BE%D0%BD-%D0%BE%D1%81%D0%BE%D0%B1%D0%B5%D0%BD%D0%BD%D0%BE-%D0%BE%D0%BF%D0%B0%D1%81%D0%B5%D0%BD-%D0%B8-%D0%BF%D0%BE%D1%87%D0%B5%D0%BC%D1%83/a-52742588;По данным ВОЗ, мужчины значительно чаще погибают от коронавирусной инфекции, чем женщины: в середине февраля уровень смертности от SARS-CoV-2 в Китае составлял 2,8 % для мужчин и 1,7 % - для женщин.;мужчины, женщины;2;;;;
https://www.mskagency.ru/materials/2985351;Главный эпидемиолог Минздрава: Мужчины чаще женщин болеют новым коронавирусом;мужчины, женщины;3;;;;
https://www.mskagency.ru/materials/2985351;Если посмотреть структуру, кто болеет новой коронавирусной инфекцией, это чаще мужчины, чем женщины, почти в два раза.;мужчины, женщины;4;;;;
https://www.mskagency.ru/materials/2985351;Новым коронавирусом чаще болеют мужчины, чем женщины.;мужчины, женщины;5;;;;
https://www.kommersant.ru/doc/4342405;Кроме того, Всемирная организация здравоохранения еще в феврале заявляла, что мужчины болеют коронавирусом чаще, чем женщины.;мужчины, женщины;6;;;;
https://www.kommersant.ru/doc/4342405;На днях о том, что мужчины тяжелее женщин болеют коронавирусом, заявил и глаза российского Минздрава Михаил Мурашко. ;мужчины, женщины;7;;;;
https://www.dw.com/ru/%D0%BA%D0%BE%D1%80%D0%BE%D0%BD%D0%B0%D0%B2%D0%B8%D1%80%D1%83%D1%81-%D0%B4%D0%BB%D1%8F-%D0%BA%D0%BE%D0%B3%D0%BE-%D0%BE%D0%BD-%D0%BE%D1%81%D0%BE%D0%B1%D0%B5%D0%BD%D0%BD%D0%BE-%D0%BE%D0%BF%D0%B0%D1%81%D0%B5%D0%BD-%D0%B8-%D0%BF%D0%BE%D1%87%D0%B5%D0%BC%D1%83/a-52742588;Мужчины, женщины и дети заражаются коронавирусом SARS-CoV-2 с одинаковой частотой.;мужчины, женщины, дети;1;;;;
https://iz.ru/975282/mariia-nediuk/gendernaia-bol-koronavirus-opasnee-dlia-muzhchin;По мнению российских специалистов, преобладание представителей сильного пола среди жертв инфекции связано с двумя причинами: мужская часть популяции более подвержена курению, поэтому в их легких вирус быстрее развивается в атипичную пневмонию. ;мужчины, курение;1;;;;
https://www.bbc.com/russian/features-52065978;SARS-CoV-2 продолжает мутировать.;мутация;1;;;;
