Ссылка;Высказывание;Ключевые слова;Счёт;;;;
https://www.bbc.com/russian/news-52643664;Буквально через пару дней американские власти одобрили использование ремдесивира для лечения Covid-19 в экстренном порядке (то есть до прохождения обязательной сертификации).;ремдесивир;7;;;;
https://www.dw.com/ru/%D1%80%D0%B5%D0%BC%D0%B4%D0%B5%D1%81%D0%B8%D0%B2%D0%B8%D1%80-%D0%BB%D0%B5%D0%BA%D0%B0%D1%80%D1%81%D1%82%D0%B2%D0%BE-%D0%BF%D1%80%D0%BE%D1%82%D0%B8%D0%B2-%D0%BA%D0%BE%D1%80%D0%BE%D0%BD%D0%B0%D0%B2%D0%B8%D1%80%D1%83%D1%81%D0%B0-%D0%BD%D0%B0%D0%B9%D0%B4%D0%B5%D0%BD%D0%BE/a-53340826;у больных с COVID-19, в лечении которых применялся ремдесивир, время выздоровления в среднем было на 31 процент короче, чем у пациентов, которым давали плацебо.;ремдесивир;8;;;;
https://www.interfax.ru/russia/708429;Академик РАН признал эффективность препарата ремдесивир при коронавирусе;ремдесивир;9;;;;
https://tass.ru/obschestvo/8880371;"Еврокомиссия (ЕК) в предварительном порядке разрешила использование препарата ""Ремдесивир"" на европейском рынке для лечения заболеваний, вызванных коронавирусом нового типа, при соблюдении ряда условий.";ремдесивир;10;;;;
https://tass.ru/obschestvo/8880371;"Как утверждают в Gilead Sciences, применение ""Ремдесивира"" пациентами с коронавирусом сокращает период выздоровления до четырех дней.";ремдесивир;11;;;;
https://tass.ru/obschestvo/8880371;"США, Япония, Республика Корея, Индия, Израиль, Великобритания одобрили использование ""Ремдесивира"" для лечения коронавирусных больных.";ремдесивир;12;;;;
https://hromadske.ua/ru/posts/dejstvitelno-li-remdesivir-pobedit-covid-19;Из него следовало, что «Ремдесивир» практически никак не помогает лечить больных Covid-19.;ремдесивир;13;;;;
https://www.forbes.ru/tehnologii/399231-chem-lechat-ot-covid-19-v-rossii-i-mire-gid-po-preparatam;1 мая FDA одобрила применение ремдесивира для лечения тяжелых случаев COVID-19.;ремдесивир;14;;;;
https://www.dw.com/ru/%D1%80%D0%B5%D0%BC%D0%B4%D0%B5%D1%81%D0%B8%D0%B2%D0%B8%D1%80-%D0%BB%D0%B5%D0%BA%D0%B0%D1%80%D1%81%D1%82%D0%B2%D0%BE-%D0%BF%D1%80%D0%BE%D1%82%D0%B8%D0%B2-%D0%BA%D0%BE%D1%80%D0%BE%D0%BD%D0%B0%D0%B2%D0%B8%D1%80%D1%83%D1%81%D0%B0-%D0%BD%D0%B0%D0%B9%D0%B4%D0%B5%D0%BD%D0%BE/a-53340826;Применение ремдесивира снижает смертность от COVID-19. ;ремдесивир;15;;;;
https://ru.wikipedia.org/wiki/COVID-19;У ремдесивира, препарата, разработанного против вируса Эболы, была показана противовирусная активность против SARS-CoV-2 «в пробирке» (in vitro) и в Китае этот препарат стал использоваться при лечении COVID-19[147].;ремдесивир;16;;;;
https://vk.com/wall-1275386_16250;За весь период в России от коронавируса скончались 14 931 человек.;Россия, смертность;1;;;;
https://takiedela.ru/news/2020/05/14/otvety-na-kovid-voprosy/;Согласно официальным данным, в России один из самых низких в мире показателей смертности от COVID-19 — около 1%. ;Россия, смертность;2;;;;
https://takiedela.ru/news/2020/05/14/otvety-na-kovid-voprosy/;Газета Financial Times пришла к выводу, что в России количество умерших от коронавируса может превышать официальные данные.;Россия, смертность;3;;;;
https://coronafake.ru/fakes/482;Логично, что данное сообщение опровергли в Министерстве образования Ставропольского края подчеркнув, что дистанционное обучение – это временная и вынужденная мера, вызванная угрозой распространения коронавируса.;самоизоляция;1;;;;
https://tass.ru/moskva/8008419;Ранее заместитель мэра столицы Анастасия Ракова опровергла информацию о возможном закрытии Москвы на карантин из-за коронавируса.;самоизоляция;2;;;;
https://savvateev.livejournal.com/298303.html;Реальная смертность от побочных причин, связанных с карантином, будет несопоставимо выше, чем смертность от коронавируса.;самоизоляция;3;;;;
https://vk.com/wall-193079545_1563;Собянин назвал слухами возвращение ограничений с 15 сентября в Москве из-за коронавируса;самоизоляция;4;;;;
https://www.bbc.com/russian/features-52065978;Карантин и другие ограничительные меры по всему миру могут продлиться (с небольшими перерывами) до тех пор, пока не будет найдена вакцина или эффективное лечение от Covid-19.;самоизоляция;5;;;;
https://xn--80aesfpebagmfblc0a.xn--p1ai/faq/;Режим самоизоляции, даже при отсутствии каких-либо симптомов, необходимо соблюдать гражданам, прибывшим из стран, неблагополучных по коронавирусной инфекции.;самоизоляция;6;;;;
https://xn--80aesfpebagmfblc0a.xn--p1ai/faq/;Всем гражданам, прибывающим из стран, неблагополучных по коронавирусной инфекции, необходимо по приезду перейти в режим самоизоляции на 14 дней, то есть не покидать жилище, не посещать работу, учебу, не приглашать к себе гостей. ;самоизоляция;7;;;;
https://www.business-gazeta.ru/article/468307;Проводимая с третьей декады марта политика тотальной «добровольной самоизоляции» населения в нашей стране не дает завершиться эпидемии коронавируса, которая при сохранении нормального ритма и порядка жизни уже, наверное, давно бы затухла.;самоизоляция;8;;;;
https://www.business-gazeta.ru/article/468307;Люди умирают не столько ОТ коронавируса, сколько С коронавирусом от совсем других болезней, заключает профессор Катасонов, поэтому карантинные истерики властей приносят только вред.;самоизоляция, смертность;1;;;;
https://xn--80aesfpebagmfblc0a.xn--p1ai/faq/;В настоящее время сезонность для COVID-19 не является доказанной.;сезонность;1;;;;
https://www.gazeta.ru/social/2020/04/24/13061701.shtml;Заболеваемость COVID-19 не зависит от погоды, подчеркивают в ВОЗ.;сезонность;2;;;;
https://www.bbc.com/russian/features-51791985;Коллоидное серебро призвал использовать для защиты от коронавируса один из гостей телешоу Джима Бейкера, американского телевизионного проповедника.;серебро;1;;;;
https://www.bbc.com/russian/features-51791985;Весть о том, что жидкое серебро может быть эффективно в борьбе с коронавирусом, разлетелась по соцсетям, особенно в сообществах, скептически настроенных к традиционной медицине.;серебро;2;;;;
https://www.forbes.ru/obshchestvo/405295-chto-lechit-covid-19-putevoditel-po-vsem-izvestnym-metodam-borby-ot-new-york;Серебро обладает некоторым бактерицидным свойством, но сделанные из него предметы не демонстрировали способность предотвращать или лечить COVID-19.;серебро;3;;;;
https://www.youtube.com/watch?v=Sd9Fqva1QQY&lc=UgzV2ZqeJ64H8-dfW9p4AaABAg.99-kv7Ce2PI990SRXxzmls;А на днях была информация о том, что сейчас идет исследование влияния сероводорода на ковид 19, есть положительный результат но испытание ещё идут.;сероводород;1;;;;
https://www.mk.ru/science/2020/05/19/koronavirus-boitsya-serovodoroda.html;Коронавирус боится сероводорода;сероводород;2;;;;
https://www.mk.ru/science/2020/05/19/koronavirus-boitsya-serovodoroda.html;Наряду с этим существуют исследования на грызунах, показавшие, что сероводород является эффективным средством против некоторых вирусов, к которым относится и COVID-19.;сероводород;3;;;;
https://www.mk.ru/science/2020/05/19/koronavirus-boitsya-serovodoroda.html;На исходной (первой) стадии инфекции сероводород должен проявлять свой противовирусный потенциал для предотвращения размножения коронавируса.;сероводород;4;;;;
https://www.mk.ru/science/2020/05/19/koronavirus-boitsya-serovodoroda.html;Комбинированная технология, основанная на ингаляции тиосульфата натрия и «горячих» гелий-кислородных дыхательных смесей при тяжелых формах коронавирусной пневмонии может предотвратить перевод больных на искусственную вентиляцию легких и сохранить им жизнь.;сероводород;5;;;;
https://www.ridus.ru/news/327661;Доктор Оникиенко из Санкт-Петербурга включил тиосульфат натрия в гелиевые смеси, которые применил в Сыктывкаре для лечения больных с подтвержденным заражением коронавирусом.;сероводород;6;;;;
https://www.ridus.ru/news/327661;В Сыктывкаре для лечения COVID-19 применили сероводород;сероводород;7;;;;
https://www.mk.ru/science/2020/05/19/koronavirus-boitsya-serovodoroda.html;Предварительные итоги испытаний свидетельствуют о том, что ингаляции тиосульфата препятствуют развитию «цитокиновой бури» (цитокины – это биологически активные белки, производимые в основном иммунными клетками), способствуют разрешению коронавирусной пневмонии и блокируют репликацию вируса в клетках-мишенях.;сероводород, цитокиновый шторм;1;;;;
https://ru.wikipedia.org/wiki/COVID-19;По симптомам COVID-19 невозможно отличить от других острых респираторных инфекций, в частности, от простуды и других ОРВИ[32].;симптом;1;;;;
https://vk.com/covid19#utm_source=vk&utm_medium=cpc&utm_campaign=web_left_nav;Если вам кажется, что у вас есть симптомы коронавируса или ОРВИ - вызовите врача.;симптом;2;;;;
https://xn--80aesfpebagmfblc0a.xn--p1ai/faq/;Основные симптомы коронавируса: высокая температура тела, кашель (сухой или с небольшим количеством мокроты), затрудненное дыхание, боль в мышцах, быстрая утомляемость.;симптом;3;;;;
https://xn--80aesfpebagmfblc0a.xn--p1ai/faq/;Если вы обнаружили симптомы, схожие с теми, которые вызывает коронавирус, оставайтесь дома и вызывайте врача.;симптом;4;;;;
https://www.bbc.com/russian/features-52065978;На начальном этапе заражения новый коронавирус активно размножается в горле и верхних дыхательных путях.;симптом;5;;;;
https://www.bbc.com/russian/features-52065978;Один из самых необычных симптомов коронавируса - потеря чувства вкуса и/или обоняния.;симптом;6;;;;
https://aif.ru/society/science/kazalos_by_pri_chyom_tut_bill_geyts_taynye_versii_proishozhdeniya_covid-19;Вскрытие шести умерших пациентов показало, что COVID-19 вызвал у них орхит — воспаление яичек. ;симптом;7;;;;
https://ru.wikipedia.org/wiki/COVID-19;Согласно анализу данных по 1099 пациентам по состоянию на 28 февраля 2020 года у 91,1 % пациентов с COVID-19 диагностировалась пневмония[18]. ;симптом;8;;;;
https://ru.wikipedia.org/wiki/COVID-19;Пневмония при COVID-19 также не может быть клинически отличимой от пневмоний, вызванных другими патогенами[80].;симптом;9;;;;
https://ru.wikipedia.org/wiki/COVID-19;Этот метод применяется и при тяжёлых формах сердечной недостаточности, которая также может возникнуть на фоне инфекции SARS-CoV-2[105].;симптом;10;;;;
https://ru.wikipedia.org/wiki/COVID-19;SARS-CoV, MERS-CoV и SARS-CoV-2 приводят к большому выбросу цитокинов[81], вызывая сильный иммунный ответ[114].;симптом;11;;;;
https://www.who.int/ru/emergencies/diseases/novel-coronavirus-2019/advice-for-public/myth-busters;Наиболее частыми симптомами COVID-19 являются сухой кашель, утомляемость и повышенная температура тела.;симптом;12;;;;
https://www.youtube.com/watch?v=FT4NWXTzhas&lc=UgwTHIvTT44qNudmkoV4AaABAg.95XqP1kwEP_96C2PAeFQ5h;Из за сухого кашля может и быть воспаление легких один из симптомах коронавируса лучше проверится а то в России уже 59 чел.;симптом;13;;;;
https://www.youtube.com/watch?v=C1k7SjX3mt4&lc=UgxtvdoSS-YTz_Qlab54AaABAg.95zASwAHdK-96FA9XlHqTo;Похоже пошли осложнения( При кашле появилась кровь с мокротой. Незнаю чем мы заболели, но все симптомы как у коронавируса. ;симптом;14;;;;
https://www.interfax.ru/russia/707066;Он подчеркнул, что резкая потеря обоняния и осязания - характерные симптомы коронавируса, которые раньше при простуде встречались гораздо реже.;симптом;15;;;;
https://yarreg.ru/articles/kt-pri-koronaviruse-panaceya-ili-biznes/;Потеря обоняния, расстройство стула – есть много симптомов, которые могут быть у COVID-19, и их надо учитывать.;симптом;16;;;;
https://xn--80aesfpebagmfblc0a.xn--p1ai/news/20200503-1054.html;Проценко рассказал, что у пациентов с коронавирусом часто пропадают осязание и обоняние;симптом;17;;;;
https://xn--80aesfpebagmfblc0a.xn--p1ai/news/20200503-1054.html;Врачи в больничном комплексе в Коммунарке в Новой Москве отметили, что у пациентов с коронавирусом часто пропадают обоняние и осязание, а на тяжелых стадиях они начинают терять вес.;симптом;18;;;;
https://www.kriis.ee/ru/koronavirus-ego-profilaktika-i-priznaki;Из пациентов с COVID-19 у 83-98% развивается лихорадка, 76-82% - сухой кашель и 11-44% - усталость или мышечная боль.;симптом;19;;;;
https://www.kriis.ee/ru/koronavirus-ego-profilaktika-i-priznaki;Менее распространенными симптомами COVID-19 являются головная боль, боль в горле, боль в животе и диарея.;симптом;20;;;;
https://www.garant.ru/products/ipo/prime/doc/73753942/;Известно, что наиболее распространенным клиническим проявлением нового варианта коронавирусной инфекции является двусторонняя пневмония, у 34% пациентов зарегистрировано развитие острого респираторного дистресс-синдрома (ОРДС).;симптом, ОРДС;;;;;
https://www.msn.com/ru-ru/health/featured/%D1%87%D1%82%D0%BE-%D0%B8%D0%B7%D0%B2%D0%B5%D1%81%D1%82%D0%BD%D0%BE-%D0%BE-%D0%B1%D0%B0%D0%BA%D1%82%D0%B5%D1%80%D0%B8%D0%B8-%C2%AB%D1%81%D0%B8%D0%BD%D1%82%D0%B8%D1%8F%C2%BB/ar-BB120CBj;"По словам Ермаковой, при попадании ""Синтии"" в организм, у человека начинаются схожие с коронавирусом симптомы: сухой кашель, высокая температура и поражение внутренних органов, в частности легких.";симптом, синтия;1;;;;
https://aif.ru/health/coronavirus/chto_takoe_bakteriya_sintiya;Новый коронавирус COVID-19 мог образоваться в результате проникновения в вирус бактерии «Синтия».;синтия;1;;;;
https://www.msn.com/ru-ru/health/featured/%D1%87%D1%82%D0%BE-%D0%B8%D0%B7%D0%B2%D0%B5%D1%81%D1%82%D0%BD%D0%BE-%D0%BE-%D0%B1%D0%B0%D0%BA%D1%82%D0%B5%D1%80%D0%B8%D0%B8-%C2%AB%D1%81%D0%B8%D0%BD%D1%82%D0%B8%D1%8F%C2%BB/ar-BB120CBj;"По словам женщины, коронавирус нужно лечить содовым раствором, так как в случаях, когда ему сопутствует ""Синтия"", не избежать летальности.";синтия;2;;;;
https://www.mythdetector.ge/ru/myth/cto-takoe-bakteria-sintia-i-svazana-li-ona-s-koronavirusom;Биолог утверждает, что именно сочетание коронавируса и бактерии Синтия делает новый вирус особенно опасным;синтия;3;;;;
https://ria.ru/20200411/1569898044.html;Коронавирус - мутировавшая Синтия;синтия;4;;;;
https://aif.ru/health/coronavirus/chto_takoe_bakteriya_sintiya;Новый коронавирус COVID-19 мог образоваться в результате проникновения в вирус бактерии «Синтия».;синтия;5;;;;
https://aif.ru/health/coronavirus/chto_takoe_bakteriya_sintiya;По ее мнению, бактерия с синтетическим геномом «Синтия», которая была искусственно выведена около десяти лет назад для борьбы с нефтяными загрязнениями в Мексиканском заливе, могла попасть в рыбу, которую в дальнейшем съел первый погибший в Китае. ;синтия;6;;;;
https://aif.ru/health/coronavirus/chto_takoe_bakteriya_sintiya;Если же вирус проник в бактерию «Синтия», то результатом мог стать смертельно-опасный новый коронавирус, считает биолог. ;синтия;7;;;;
https://factcheck.kz/health/lozh-covid-19-soderzhit-fragment-smertelno-opasnoj-sinteticheskoj-bakterii-sintiya/;Ложь | COVID-19 содержит фрагмент смертельно опасной синтетической бактерии Синтия;синтия;8;;;;
https://coronafake.ru/fakes/vlasti-skryvayut-realnyj-procent-smertej-ot-koronavirusa;Власти скрывают реальный процент смертей от коронавируса;смертность;1;;;;
https://habr.com/ru/post/494896/;Для подавляющего большинства здоровых людей риск умереть от Covid-19 или умереть от чего-то ещё намного ниже приведённых выше значений.;смертность;2;;;;
https://habr.com/ru/post/494896/#comment_21472460;От короновируса в США уже умерло 12242 человека за 2 месяца;смертность;3;;;;
https://www.spb.kp.ru/daily/27113/4192700/;Множество людей с коронавирусом, ушедших в мир иной, умерли бы в любом случае;смертность;4;;;;
https://www.spb.kp.ru/daily/27113/4192700/;По самым скромным подсчетам летальность от COVID составляет 1, 5 — 1,7% заболевших. ;смертность;5;;;;
https://www.spb.kp.ru/comments/article/4192700/;Человек очень точно подметил сущность манипуляций и подтасовок со смертностью от ковида 19.;смертность;6;;;;
https://www.youtube.com/watch?v=O8SZevPdins&lc=UgypOYitQegXcpHl19B4AaABAg;Конечно здоровые люди не умирают от короновируса!!;смертность;7;;;;
https://vk.com/wall-25280329_427007?reply=427029&thread=427012;пока что больше людей умирает от борьбы с ковидом чем от самого ковида. ;смертность;8;;;;
https://www.bbc.com/russian/features-52065978;Уровень смертности от Covid-19 пока сложно подсчитать с точностью, но большинство исследований оценивают его на уровне 1-3%.;смертность;9;;;;
https://www.bbc.com/russian/features-52065978;Смертность от Covid-19 сильно зависит от общей нагрузки на систему здравоохранения и скорости оказания помощи: если в Германии она составляет всего 0,3%, то в Италии - почти 9%.;смертность;10;;;;
https://ru.wikipedia.org/wiki/COVID-19;В сравнении с тяжёлым острым респираторным синдромом и ближневосточным респираторным синдромом летальность у COVID-19 намного ниже.;смертность;11;;;;
https://ru.wikipedia.org/wiki/COVID-19;Смертность из-за COVID-19, вероятно, выше, чем в случае сезонного гриппа.;смертность;12;;;;
https://ru.wikipedia.org/wiki/COVID-19;в то время как в случае COVID-19, по текущим данным, риск выше для пожилых людей и людей с хроническими болезнями[173].;смертность;13;;;;
http://www.privatmed.ru/article/37/239/2538/;Неправомерно говорить и о большой угрозе здоровью населения от COVID-19.;смертность;14;;;;
http://www.privatmed.ru/article/37/239/2538/;Это и понятно, так как летальность от COVID-19 низка.;смертность;15;;;;
